{"as_of":"2026-10-25T08:00:00Z","code_points_charged":0,"evaluated_at":"2026-10-25T08:00:01Z","id":"rcp_60613194f60a520d3d1483ee50f4950f24aa1da877b75d6ec81b039e162d9596","item_ref":"ir_bab2df15100f72e476d549f5cb6f0e03e170ccb29268b77cf8bb2402d57e094d","markdown_sha256":"2222222222222222222222222222222222222222222222222222222222222222","outcome":"tombstoned","purpose":"citation_link","reader":"newsroom","reservation":"6666666666666666666666666666666666666666666666666666666666666666","schema":"zeo.access-receipt/v2","state":"tombstoned"}