{"as_of":"2026-10-25T08:00:00Z","code_points_charged":0,"evaluated_at":"2026-10-25T08:00:01Z","id":"rcp_987bad100920b54a990db6800d9e7c8e4dafa56cb96412f25f5e60b462cd4639","item_ref":"ir_bab2df15100f72e476d549f5cb6f0e03e170ccb29268b77cf8bb2402d57e094d","markdown_sha256":"2222222222222222222222222222222222222222222222222222222222222222","outcome":"not_found","purpose":"citation_link","reader":"newsroom","reservation":"6666666666666666666666666666666666666666666666666666666666666666","schema":"zeo.access-receipt/v2","state":"not_found"}