{"as_of":"2026-10-25T08:00:00+00:00","code_points_charged":0,"evaluated_at":"2026-10-25T08:00:01Z","id":"rcp_478701551c088ece7641a12bb07b072efe4dcae0ef20ee99f6bd484497afbfe0","item_ref":"ir_bab2df15100f72e476d549f5cb6f0e03e170ccb29268b77cf8bb2402d57e094d","markdown_sha256":"2222222222222222222222222222222222222222222222222222222222222222","outcome":"served","purpose":"citation_link","reader":"newsroom","reservation":"6666666666666666666666666666666666666666666666666666666666666666","rights_class":"citation_link_only","schema":"zeo.access-receipt/v2","state":"ready","view_length":532,"view_sha256":"aca55b96015cf1d32f79088b0bc3d3c44e5d05726b28c468034cb0859ef32fc2"}