{"as_of":"2026-10-25T08:00:00Z","code_points_charged":0,"evaluated_at":"2026-10-25T08:00:01Z","id":"rcp_c754168176dd328cc2c8a473ca845fc53b85c566251437f91ad009cd8dcb06e5","item_ref":"ir_bab2df15100f72e476d549f5cb6f0e03e170ccb29268b77cf8bb2402d57e094d","markdown_sha256":"2222222222222222222222222222222222222222222222222222222222222222","outcome":"tombstoned","purpose":"citation_link","reader":"newsroom","reservation":"6666666666666666666666666666666666666666666666666666666666666666","rights_class":"citation_link_only","schema":"zeo.access-receipt/v2","state":"tombstoned","view_length":532,"view_sha256":"aca55b96015cf1d32f79088b0bc3d3c44e5d05726b28c468034cb0859ef32fc2"}